{
  "schema": "atlas-character-grammar/v1",
  "grammar_id": "atlas_character_grammar",
  "revision": 1,
  "anatomy_relationships": [
    {
      "region": "shoulder_girdle",
      "relations": [
        "clavicle connects sternum to scapula",
        "scapula supports the deltoid and upper arm",
        "pectorals blend chest into the front of the upper arm",
        "latissimus blends back into the rear of the upper arm",
        "axilla is a continuous concave transition between torso and upper arm"
      ],
      "surface_policy": "Generate as one continuous deformable body surface with a smooth shoulder-to-chest transition; no floating shoulder or armpit filler objects.",
      "review_status": "draft"
    },
    {
      "region": "limb_junctions",
      "relations": [
        "upper arm joins the shoulder girdle",
        "forearm joins upper arm at elbow",
        "thigh joins pelvis at hip",
        "calf joins thigh at knee"
      ],
      "surface_policy": "Maintain surface continuity through the neutral pose and preserve volume across joint landmarks.",
      "review_status": "approved"
    }
  ],
  "shared_defaults": {
    "proportion_multipliers": {
      "jaw": 1.0,
      "hand": 1.0,
      "foot": 1.0,
      "ear": 1.0,
      "nose": 1.0,
      "head": 1.0
    },
    "pose": "t_pose_fingers_spread",
    "surface_style": "realistic"
  },
  "archetypes": {
    "humanoid": {
      "proportion_multipliers": {},
      "silhouette_tags": [
        "human_proportions"
      ],
      "material_tags": [],
      "review_status": "approved",
      "evidence": []
    }
  },
  "evidence_policy": {
    "reference_use": "measurements_and_evidence_only",
    "minimum_reviewed_examples": 3,
    "notes": [
      "A reference contributes measurements and evidence; it is not copied as final geometry.",
      "No learned rules are currently promoted from an observation dataset.",
      "A material tag is a recipe label, not proof that a shader or texture exists."
    ]
  }
}
